{
  "schema_version": 1,
  "policy_id": "EV4-CE-CONSTRUCTABILITY-DECISION-POLICY-r001",
  "loading_mode": "manual_advisory_attachment_only",
  "decision_scope": "kernel_governed_choice",
  "decision_family": "layout_structure",
  "requested_option": "grid_tracks",
  "upstream_decision_lineage": [
    {
      "decision_family": "layout_structure",
      "decision_card_ref": "DK-CARD-layout-structure-001",
      "selected_option": "grid_tracks",
      "rejected_options": [
        "flex_wrap"
      ],
      "evidence_refs": [
        "EVD-001"
      ],
      "evidence_state": "validated",
      "consumer_stage": "constructability_engineer"
    }
  ],
  "external_domain_artifacts": [
    {
      "domain_id": "LAYOUT_STRUCTURE",
      "artifact_ref": "external-unverified-example",
      "trust_class": "unverified_advisory",
      "changed_decision_outcome": false
    }
  ],
  "expected": {
    "validation_pass": true
  }
}
